{
  "$schema": "http://json-schema.org/draft-07/schema#",
  "title": "DevAutopilot Task Plan",
  "type": "object",
  "required": ["project", "tasks"],
  "properties": {
    "project": {
      "type": "string",
      "description": "Project name or path"
    },
    "session_id": {
      "type": "string",
      "description": "Session ID from planning phase (optional)"
    },
    "agent": {
      "type": "string",
      "enum": ["claude", "opencode", "codex", "cline", "cursor", "cli"],
      "description": "Default agent for execution"
    },
    "defaults": {
      "type": "object",
      "properties": {
        "max_turns": { "type": "integer", "default": 30 },
        "max_budget_usd": { "type": "number", "default": 2.0 },
        "allowed_tools": {
          "type": "array",
          "items": { "type": "string" }
        },
        "verify_command": { "type": "string" }
      }
    },
    "max_parallel": {
      "type": "integer",
      "minimum": 1,
      "description": "Maximum number of parallel tasks"
    },
    "tasks": {
      "type": "array",
      "minItems": 1,
      "items": {
        "type": "object",
        "required": ["id", "title", "spec"],
        "properties": {
          "id": { "type": "string", "pattern": "^T-[0-9]{3}$" },
          "title": { "type": "string" },
          "spec": { "type": "string" },
          "depends_on": {
            "type": "array",
            "items": { "type": "string" },
            "default": []
          },
          "agent": {
            "type": "string",
            "enum": ["claude", "opencode", "codex", "cline", "cursor", "cli"]
          },
          "verify_command": { "type": "string" },
          "max_turns": { "type": "integer" },
          "max_budget_usd": { "type": "number" },
          "allowed_tools": {
            "type": "array",
            "items": { "type": "string" }
          },
          "fork_session": { "type": "boolean", "default": true },
          "judge": {
            "type": "boolean",
            "description": "Enable Judge Agent review for this task"
          },
          "acceptance_criteria": {
            "type": "array",
            "items": { "type": "string" },
            "description": "Acceptance criteria list — each item is an observable verification condition"
          },
          "user_intent": {
            "type": "string",
            "description": "Why this task is needed — the user's underlying goal"
          }
        }
      }
    }
  }
}
